{
  "$id": "https://posthog-impact.local/schemas/issues.schema.json",
  "$schema": "https://json-schema.org/draft/2020-12/schema",
  "additionalProperties": false,
  "properties": {
    "assignee_logins": {
      "arrow_type": "list<element: string>",
      "type": [
        "array",
        "null"
      ]
    },
    "author_actor_id": {
      "arrow_type": "string",
      "type": [
        "string",
        "null"
      ]
    },
    "author_login": {
      "arrow_type": "string",
      "type": [
        "string",
        "null"
      ]
    },
    "body_text": {
      "arrow_type": "string",
      "type": [
        "string",
        "null"
      ]
    },
    "closed_at": {
      "arrow_type": "string",
      "type": [
        "string",
        "null"
      ]
    },
    "comment_count": {
      "arrow_type": "int64",
      "type": [
        "integer",
        "null"
      ]
    },
    "computed_at": {
      "arrow_type": "string",
      "type": [
        "string",
        "null"
      ]
    },
    "created_at": {
      "arrow_type": "string",
      "type": [
        "string",
        "null"
      ]
    },
    "created_in_window": {
      "arrow_type": "bool",
      "type": [
        "boolean",
        "null"
      ]
    },
    "issue_id": {
      "arrow_type": "string",
      "type": [
        "string",
        "null"
      ]
    },
    "issue_number": {
      "arrow_type": "int64",
      "type": [
        "integer",
        "null"
      ]
    },
    "labels": {
      "arrow_type": "list<element: string>",
      "type": [
        "array",
        "null"
      ]
    },
    "state": {
      "arrow_type": "string",
      "type": [
        "string",
        "null"
      ]
    },
    "state_reason": {
      "arrow_type": "string",
      "type": [
        "string",
        "null"
      ]
    },
    "title": {
      "arrow_type": "string",
      "type": [
        "string",
        "null"
      ]
    },
    "updated_at": {
      "arrow_type": "string",
      "type": [
        "string",
        "null"
      ]
    },
    "url": {
      "arrow_type": "string",
      "type": [
        "string",
        "null"
      ]
    }
  },
  "title": "issues",
  "type": "object",
  "x-pipeline-version": "1.0.0",
  "x-schema-version": "1.0.0"
}
