[
  {
    "assignee_logins": [],
    "author_actor_id": "github/user/neilkakkar",
    "author_login": "neilkakkar",
    "body_text": "Is your feature request related to a problem?\nI want to be able to order the different bars on a lifecycle graph (i.e. new, resurrecting, or recurring users) so I can more easily compare what I care a",
    "closed_at": "2026-08-07T10:04:43Z",
    "comment_count": 3,
    "computed_at": "2026-08-17T14:45:38.551625Z",
    "created_at": "2023-03-06T23:44:42Z",
    "created_in_window": false,
    "issue_id": "github.com/PostHog/posthog#issue/14579",
    "issue_number": 14579,
    "labels": [
      "enhancement",
      "good first issue",
      "feature/lifecycle",
      "team/product-analytics"
    ],
    "state": "CLOSED",
    "state_reason": "COMPLETED",
    "title": "Allow sorting Lifecycle graph bars",
    "updated_at": "2026-08-07T10:04:43Z",
    "url": "https://github.com/PostHog/posthog/issues/14579"
  },
  {
    "assignee_logins": [],
    "author_actor_id": "github/user/corywatilo",
    "author_login": "corywatilo",
    "body_text": "Bug description\nPostHog doesn't support HTML selector matches with CSS classes that contain non-alphanumeric characters. This becomes a problem for sites that use Tailwind CSS. If a customer is strict",
    "closed_at": null,
    "comment_count": 5,
    "computed_at": "2026-08-17T14:45:38.551712Z",
    "created_at": "2023-05-10T18:19:50Z",
    "created_in_window": false,
    "issue_id": "github.com/PostHog/posthog#issue/15480",
    "issue_number": 15480,
    "labels": [
      "bug",
      "feature/actions"
    ],
    "state": "OPEN",
    "state_reason": null,
    "title": "Actions: HTML selector only supports alphanumeric CSS classes",
    "updated_at": "2025-12-03T17:12:59Z",
    "url": "https://github.com/PostHog/posthog/issues/15480"
  },
  {
    "assignee_logins": [],
    "author_actor_id": "github/user/neilkakkar",
    "author_login": "neilkakkar",
    "body_text": "Bug description\nThe hashkeyoverrides table can grow seriously out of control because it keeps all rows for stale flags. We cascade delete, but since flags are soft deleted, this table doesn't clean it",
    "closed_at": null,
    "comment_count": 5,
    "computed_at": "2026-08-17T14:45:38.551794Z",
    "created_at": "2023-08-02T11:55:02Z",
    "created_in_window": false,
    "issue_id": "github.com/PostHog/posthog#issue/16885",
    "issue_number": 16885,
    "labels": [
      "bug",
      "feature/feature-flags",
      "team/feature-flags",
      "backlog"
    ],
    "state": "OPEN",
    "state_reason": null,
    "title": "Feature Flag Hash Key Overrides table can grow out of control",
    "updated_at": "2026-06-22T18:54:13Z",
    "url": "https://github.com/PostHog/posthog/issues/16885"
  },
  {
    "assignee_logins": [],
    "author_actor_id": "github/user/liyiy",
    "author_login": "liyiy",
    "body_text": "Bug description\n\nPlease describe.\nThe above is showing up on a feature flag page\nIf you are on PostHog Cloud it would be really valuable if you can share any links where the problem occurs. This speed",
    "closed_at": "2026-08-11T00:16:24Z",
    "comment_count": 0,
    "computed_at": "2026-08-17T14:45:38.551876Z",
    "created_at": "2023-12-15T17:37:35Z",
    "created_in_window": false,
    "issue_id": "github.com/PostHog/posthog#issue/19367",
    "issue_number": 19367,
    "labels": [
      "bug",
      "good first issue",
      "feature/feature-flags",
      "team/feature-flags"
    ],
    "state": "CLOSED",
    "state_reason": "COMPLETED",
    "title": "Feature flags: Do not know how to serialize a BigInt type error",
    "updated_at": "2026-08-11T00:16:24Z",
    "url": "https://github.com/PostHog/posthog/issues/19367"
  },
  {
    "assignee_logins": [],
    "author_actor_id": "github/user/marconlp",
    "author_login": "MarconLP",
    "body_text": "Bug description\nError: Failed to execute 'removeChild' on 'Node': The node to be removed is not a child of this node.\n    at QF (https://app-static-prod.posthog.com/static/chunk-R7DGFOT7.js:13:26102)\n",
    "closed_at": null,
    "comment_count": 2,
    "computed_at": "2026-08-17T14:45:38.551895Z",
    "created_at": "2024-01-09T11:46:19Z",
    "created_in_window": false,
    "issue_id": "github.com/PostHog/posthog#issue/19663",
    "issue_number": 19663,
    "labels": [
      "bug",
      "feature/dashboards",
      "team/product-analytics"
    ],
    "state": "OPEN",
    "state_reason": null,
    "title": "changing timeframe of dashboard breaking while using google translate",
    "updated_at": "2025-08-18T18:49:52Z",
    "url": "https://github.com/PostHog/posthog/issues/19663"
  },
  {
    "assignee_logins": [],
    "author_actor_id": "github/user/marconlp",
    "author_login": "MarconLP",
    "body_text": "Is your feature request related to a problem?\nWhen trying to set up funnel exclusion steps, it's currently not possible to apply filters or use actions.\n\nAdditional context\nhttps://posthoghelp.zendesk",
    "closed_at": null,
    "comment_count": 7,
    "computed_at": "2026-08-17T14:45:38.551929Z",
    "created_at": "2024-01-16T11:41:46Z",
    "created_in_window": false,
    "issue_id": "github.com/PostHog/posthog#issue/19776",
    "issue_number": 19776,
    "labels": [
      "enhancement",
      "feature/funnels",
      "team/product-analytics",
      "support/priority"
    ],
    "state": "OPEN",
    "state_reason": null,
    "title": "Feature request: Use actions or apply filters in funnel exclusion steps",
    "updated_at": "2026-06-22T10:53:09Z",
    "url": "https://github.com/PostHog/posthog/issues/19776"
  },
  {
    "assignee_logins": [],
    "author_actor_id": "github/user/jamesefhawkins",
    "author_login": "jamesefhawkins",
    "body_text": "Initial product design\nThis is not split into MVP versus regular product. It's a list of common requirements we'll face in the first few months, and was based on going through our own implementation o",
    "closed_at": "2020-02-22T05:28:26Z",
    "comment_count": 5,
    "computed_at": "2026-08-17T14:45:38.551249Z",
    "created_at": "2020-01-25T17:28:27Z",
    "created_in_window": false,
    "issue_id": "github.com/PostHog/posthog#issue/1",
    "issue_number": 1,
    "labels": [
      "enhancement"
    ],
    "state": "CLOSED",
    "state_reason": "COMPLETED",
    "title": "Reports that users will need",
    "updated_at": "2022-03-10T15:24:49Z",
    "url": "https://github.com/PostHog/posthog/issues/1"
  },
  {
    "assignee_logins": [],
    "author_actor_id": "github/user/aseemk",
    "author_login": "aseemk",
    "body_text": "Feature request\nIs your feature request related to a problem?\nI want to create cohorts, and browse recent people, while filtering out internal & test users.\nDescribe the solution you'd like\nI'd love t",
    "closed_at": "2026-07-30T03:55:44Z",
    "comment_count": 2,
    "computed_at": "2026-08-17T14:45:38.551993Z",
    "created_at": "2024-04-30T21:56:49Z",
    "created_in_window": false,
    "issue_id": "github.com/PostHog/posthog#issue/21999",
    "issue_number": 21999,
    "labels": [
      "enhancement",
      "feature/cohorts",
      "team/feature-flags"
    ],
    "state": "CLOSED",
    "state_reason": "COMPLETED",
    "title": "Support filtering internal & test users out of cohorts (and/or when browsing people in general)",
    "updated_at": "2026-07-30T03:55:44Z",
    "url": "https://github.com/PostHog/posthog/issues/21999"
  },
  {
    "assignee_logins": [],
    "author_actor_id": "github/user/slshults",
    "author_login": "slshults",
    "body_text": "Feature request\nRelated ticket for ordering: #34853\nIs your feature request related to a problem?\nOn a dashboard with similar bar charts, the similar values for the series can be displayed in differen",
    "closed_at": "2026-07-24T07:12:28Z",
    "comment_count": 12,
    "computed_at": "2026-08-17T14:45:38.552029Z",
    "created_at": "2024-06-19T19:50:41Z",
    "created_in_window": false,
    "issue_id": "github.com/PostHog/posthog#issue/23093",
    "issue_number": 23093,
    "labels": [
      "enhancement",
      "team/product-analytics",
      "feature/insights"
    ],
    "state": "CLOSED",
    "state_reason": "COMPLETED",
    "title": "Feature Request: Ability to change color and order of series on bar chart on a dashboard",
    "updated_at": "2026-07-24T07:12:28Z",
    "url": "https://github.com/PostHog/posthog/issues/23093"
  },
  {
    "assignee_logins": [],
    "author_actor_id": "github/user/skoob13",
    "author_login": "skoob13",
    "body_text": "Bug Description\nBug description\nWhenever I edit a Trends insight, I get the text below on the History of Product Analytics page.\n\nEmployee 427 renamed \"Pageview count by event's Browser\" to \"[Pageview",
    "closed_at": "2026-07-27T07:47:19Z",
    "comment_count": 0,
    "computed_at": "2026-08-17T14:45:38.552124Z",
    "created_at": "2024-07-10T17:34:02Z",
    "created_in_window": false,
    "issue_id": "github.com/PostHog/posthog#issue/23615",
    "issue_number": 23615,
    "labels": [
      "bug",
      "P2",
      "team/product-analytics"
    ],
    "state": "CLOSED",
    "state_reason": "COMPLETED",
    "title": "Bug Report: History of insights doesn't serialize to a human-readable format a Trends query",
    "updated_at": "2026-07-27T07:47:19Z",
    "url": "https://github.com/PostHog/posthog/issues/23615"
  },
  {
    "assignee_logins": [],
    "author_actor_id": "github/user/slshults",
    "author_login": "slshults",
    "body_text": "Feature request\nWhen applying one or more filters to a dashboard, allow insights to be excluded from the dashboard filter(s) on an insight-by-insight basis.\nAdditional context\nFrom: https://posthoghel",
    "closed_at": "2026-07-22T15:22:59Z",
    "comment_count": 0,
    "computed_at": "2026-08-17T14:45:38.552145Z",
    "created_at": "2024-07-16T20:52:16Z",
    "created_in_window": false,
    "issue_id": "github.com/PostHog/posthog#issue/23762",